ticket.id,gt_category_1,gt_department,text,summary,gt_category_2,level_2,level_2_category_2,level_1,token_count
454670,Feedback / Improvement,Customer,"user: Order ID: N/A Ticket Category: Loyalty Check  Issue: User is facing some problem with loyalty check  Chat/ Image URL: Not provided Channel: Mobile App  Chat URL: https://cloud.yellow.ai/public/messages/a9c98542dd91bca8b5a09e8ad27023c32b1ea5be685a4e6f039dd3a9663b3d9968745593688efdffb32c7515834432745111e06bf20124d4/66aafa68cc22cd00011a091f
agent: Welcome to ZUS Coffee! ⚡

agent: Please select the language you want to converse in

user: English
agent: Great! May I have your mobile number?
(eg: 601XXXXXXXX)

user: 017-2675213
agent: Sorry, the phone number you entered appears to be invalid. Please ensure you have entered a valid ZUS Coffee registered contact number.
(ex: 601XXXXXXXX)

user: 60172675213
agent: Sorry, the phone number you entered appears to be invalid. Please ensure you have entered a valid ZUS Coffee registered contact number.
(ex: 601XXXXXXXX)

user: 60129531691
agent: Thank you for your details.

agent: Hi tang lena how can I help you today?

user: 5
agent: Thank you for sharing the details with us. Kindly select the option below for your ZUS Rewards update:

1. Your Current Loyalty Level: Easy Goer - Earn 1x ZUS Point for every RM1 spent.
Enjoy 1x free drink with every 10x cups purchased. (Not applicable for purchases with discount vouchers)
2. Next Loyalty Level: Rising Star
3. Current ZUS Points: 1
4. Current Cup Count: 3
5. How much cup counts to be upgraded: 10

agent: Did I answer your question?

user: No
user: All my points gone
user: Yesterday was 911
agent: Hi Tang Lena, we're currently handling multiple inquiries. Please bear with us as we prioritise and attend to yours as soon as possible. Thank you for your patience.

agent: Hi there, we truly apologize for the late response due to overwhelming inquiries and we appreciate your kind patience on this matter.

agent: Upon checking, your points have been expired due to inactivity. In order for you to keep your points active, you may need to earned atleast (1) one points from your order within 3 months from your last order.

agent: You may check these information by open ZUS apps -> Rewards -> Redeem Rewards, then scroll down until you see the FAQ button.

agent: We hope this helps.

agent: Kindly reopen this chat if you need further assistance from our end. Please do not hesitate to chat with us here and we will assist you as soon as we can. Once again we truly apologize for our late response. Thank you and have a good day!

agent: Based on your conversation, please rate our services on a scale from 1-5.
1 being the least and 5 being the highest

user: All my points gone
user: Yesterday was 911
agent: Hi Tang Lena, we're currently handling multiple inquiries. Please bear with us as we prioritise and attend to yours as soon as possible. Thank you for your patience.
agent: Hi there, we truly apologize for the late response due to overwhelming inquiries and we appreciate your kind patience on this matter.

agent: Upon checking, your points have been expired due to inactivity. In order for you to keep your points active, you may need to earned atleast (1) one points from your order within 3 months from your last order.
agent: You may check these information by open ZUS apps -> Rewards -> Redeem Rewards, then scroll down until you see the FAQ button.
agent: We hope this helps.
agent: Kindly reopen this chat if you need further assistance from our end. Please do not hesitate to chat with us here and we will assist you as soon as we can. Once again we truly apologize for our late response. Thank you and have a good day!
","Customer sentiment: Irritated  
Primary Issue: The customer is experiencing a problem with their loyalty points, stating that all their points are gone and referencing a specific date (yesterday was 911) which may indicate a recent transaction or event related to their loyalty account.  
Cause of issue: The customer's points have expired due to inactivity, as they did not earn at least one point from an order within three months of their last order.  
Overall Summary: The customer reached out regarding their loyalty points, expressing frustration that all their points have disappeared. The agent informed the customer that the points expired due to inactivity and provided guidance on how to keep points active in the future. The interaction included delays in response due to high inquiry volume, which contributed to the customer's irritation.",App - Loyalty Issue,NO INTENT,NO INTENT,ACCOUNT & CONTACT MANAGEMENT,4818
443654,Feedback / Improvement,Tech,"Hi Heng,     Greeting from ZUS Coffee.     First and foremost, we sincerely apologise for your experience that you have encountered with us.     Pertaining to your inquiry, may we clarify are you referring to outlet in East Malaysia?      If yes, we are regret to inform you that most outlet in East Malaysia has limited quantity of cakes available. Rest assured we will restock soon however there is no date was given.     Since we unable to reconfirm on the restock date, kindly revert back to us if you would like to exchange your birthday voucher with 1x complimentary drink voucher to redeem.     Hope to hear from you soon.     -- Best Regards,  Nur Aliah Customer Happiness Specialist     E. support@zuscoffee.com  W. www.zuscoffee.com
Sure, thank you



Hi Heng_0623,     ​Thank you for the provided details. The voucher has already been added to your account. If you need further assistance, please feel free to reach out to us via Live Chat or WhatsApp at 60128161340. We will be happy to assist you.      Thank you once again and have a great day ahead.  Best Regards,    Alia Customer Happiness Specialist     E. support@zuscoffee.com  W. www.zuscoffee.com
heng_0623@hotmail.com or 0109602411


Sent from my iPhone


Hi Heng_0623,     Greetings from ZUS Coffee.     We apologize for the delayed response. To address the issue mentioned, could you please provide us with the email address registered with the ZUS Coffee App? This will allow us to add the voucher as soon as possible.     Thank you for your understanding.   Best Regards,    Alia Customer Happiness Specialist     E. support@zuscoffee.com  W. www.zuscoffee.com
HELLO ZUS

[image0.png]
Sent from my iPhone


GOOD AFTERNOON ZUS,

ANY UPDATE FOR THE VOUCHER?

MY VOUCHER EXPIRE SOON


Hi Zus,

Thanks for reply.

Yes, im in Miri Sarawak.
I see, then I will like to exchange my birthday voucher pls.

Thank you very much.


","Customer sentiment: Irritated  
Primary Issue: The customer is inquiring about the status of their birthday voucher and is concerned about its impending expiration. They also express frustration over the limited availability of cakes at the East Malaysia outlet.  
Cause of issue: The limited quantity of cakes available at the East Malaysia outlet is causing the customer to seek an exchange for their birthday voucher, as they cannot redeem it for cakes. Additionally, there is no confirmed restock date for the cakes, which adds to the customer's frustration.  
Overall Summary: The customer expressed irritation regarding the limited availability of cakes at the East Malaysia outlet and the impending expiration of their birthday voucher. The customer service agent informed them that they could exchange the birthday voucher for a complimentary drink voucher due to the lack of cake availability. The voucher was successfully added to the customer's account after they provided their email address.",App - Loyalty Issue,PRODUCT / MENU DETAILS,Product / Menu Details,INQUIRIES & SUGGESTIONS,4738
439592,Feedback / Improvement,Tech,"Chat Transcript: https://cloud.yellow.ai/public/messages/a9c98542dd91bca8b5a09e8ad27023c37117a9f66e0b4d35539fd4b8727c67cb2d3405d621/668d1d071d711d0001fc47b2
user: Hi I wish to change my ZUS account phone number
agent: Welcome to ZUS Coffee! ⚡

agent: Please select the language you want to converse in

user: en
agent: Great! May I have your mobile number?
(eg: 601XXXXXXXX)

user: 610162826416
agent: Sorry, the phone number you entered appears to be invalid. Please ensure you have entered a valid ZUS Coffee registered contact number.
(ex: 601XXXXXXXX)

user: 60162826416
agent: Thank you for your details.

agent: Hi Chen Chee Xiang how can I help you today?

user: 4
agent: We sincerely apologize for the inconvenience caused by the issue with our app.

Rest assured, our team is working diligently to resolve the problem and ensure that it doesn't happen again in the future.

Kindly select the option below

user: 2
agent: We have trigger OTP to your Phone number, please check

agent: Did I answer your question?

user: 3
agent: Hi Chen Chee Xiang how can I help you today?

user: 5
agent: Thank you for sharing the details with us. Kindly select the option below for your ZUS Rewards update:

1. Your Current Loyalty Level: Easy Goer - Earn 1x ZUS Point for every RM1 spent.
Enjoy 1x free drink with every 10x cups purchased. (Not applicable for purchases with discount vouchers)
2. Next Loyalty Level: Rising Star
3. Current ZUS Points: 0
4. Current Cup Count: 1
5. How much cup counts to be upgraded: 10

agent: Did I answer your question?

user: 3
agent: Hi Chen Chee Xiang how can I help you today?

user: 8
agent: Please select the relevant category.

user: 9
agent: Please select the relevant category.

user: 2
agent: ZUS Membership Related Questions

user: 2
agent: Keep drinking more ZUS! The more cups you purchase over time, the higher your membership ranking on ZUS App.

*Drink 10 cups:* You'll upgrade to the Rising Star.
*Drink an additional 9 cups:* Elevate your status from Rising Star to Super Addict.
*Drink another 8 cups:* Achieve the highest membership level, ZUS Elite.

Note: Only applicable to handcrafted drinks at full price. Order(s) applied with discount vouchers are not eligible for membership level upgrades.

agent: Did I answer your question?

user: 2
agent: Apologies, please wait while I connect you with an agent to serve you better

agent: Chen Chee Xiang, can you explain your issue briefly?

user: Alright
agent: A live agent has been connected

user: Hi! I would like to change my account phone number.
agent: Hi this is Logeswary, please give me a moment to carefully review your selected options and I'll get back to you soon. Your patience is appreciated!

agent: Kindly provide us details as per below for us to assist further on this:

1. Old phone number:
2. New phone number:

user: Kindly provide us details as per below for us to assist further on this:

1. Old phone number: +60162826416
2. New phone number: +601115086416
agent: Thank you for the details and we aleady updated the new phone number as per your request.

agent: Hope this clarifies. Apart from this, is there anything else I can assist you with?

user: Thanks for helping!
user: That’s all from me
agent: Your most welcome😀

agent: Thank you and have a pleasant day ahead! 😊

agent: Should you need further assistance, please do not hesitate to chat with us here and we will assist you as soon as we can.

agent: If you have a minute kindly rate this Live Chat after I end the conversation. I would appreciate your kind feedback on my service today as this will allow me to improve myself to serve you better. 🙂

user: Sure 👌
agent: Based on your conversation, please rate our services on a scale from 1-5.
1 being the least and 5 being the highest

user: five
agent: I'm glad.
Please feel free to reach out to me for any further queries.

When in need just say ""Hi""
","Customer sentiment: Happy  
Primary Issue: The customer wanted to change their ZUS account phone number from +60162826416 to +601115086416.  
Cause of issue: The customer initially faced difficulty entering their phone number correctly, which led to confusion and required assistance from the agent to complete the update.  
Overall Summary: The customer contacted support to change their phone number associated with their ZUS account. After some initial confusion with entering the correct number, the customer provided the old and new phone numbers. The agent successfully updated the phone number and confirmed the change. The customer expressed satisfaction with the service, rating it a five out of five.",App - OTP,CHANGE / UPDATE INFO,Change / Update Info,ACCOUNT & CONTACT MANAGEMENT,4876
453587,Cancellation,Customer,"user: Order ID: - Ticket Category: Invalid Phone number  Issue: User Phone number [6011112320123] is not registered  Chat/ Image URL: Not provided Channel: Mobile App  Chat URL: https://cloud.yellow.ai/public/messages/a9c98542dd91bca8b5a09e8ad27023c32150fea23c5d4c6103c9d3a966393c996b7f53976287f4ffb32c7515834432745111e06bf20124d4/66a8b6cbcc05910001385f09
agent: Welcome to ZUS Coffee! ⚡

agent: Please select the language you want to converse in

user: English
agent: Great! May I have your mobile number?
(eg: 601XXXXXXXX)

user: 01111232013
agent: Sorry, the phone number you entered appears to be invalid. Please ensure you have entered a valid ZUS Coffee registered contact number.
(ex: 601XXXXXXXX)

user: /60111
agent: Sorry, the phone number you entered appears to be invalid. Please ensure you have entered a valid ZUS Coffee registered contact number.
(ex: 601XXXXXXXX)

user: 6011112320123
agent: Before we proceed further could you help me with your name?

user: 601111232013
agent: Can you please repeat this, looks like an Invalid name

user: wong hiew en
user: i would like to complain
agent: Hi this is Sha, please give me a moment to carefully review your selected options and I'll get back to you soon. Your patience is appreciated!

user: i requested my drink with no ice but they only give me half cup of the drinks
agent: How may I assist you?

user: 
user: i requested my drink with no ice but they only give me half cup of the drinks
user: hello?
user: i requested my drink with no ice but they only give me half cup of the drinks Tue 5:52 PM hello?
user: yes
user: ?
agent: If you ask for less or no ice, the drink will have a smaller volume because there will be no ice added.

user: i accept with smaller volumn
user: but not even half of it
user: 
agent: Thank you for the picture provided. Both drink in the picture is yours?

user: yes
agent: Was your order placed at the counter?

user: in the app
agent: May I get the order ID or registered email address for further checking?

user: email address: adelinewonghiewyaw@gmail.com
user: 24073035609
user: order id
user: i would like to refund now
user: i didn't pickup now
agent: Please hold while I check further on this.

user: please proceed quickly
user: any update?
agent: Thank you for waiting. We apologize for any inconvenience. Upon review, the drink will be served without ice as shown in the picture. Would you prefer to add ice to the drink or would you like to cancel the order?

user: ady 5
user: cancel order
user: any update?
agent: 

agent: We already refunded the amount to your Touch&Go e-wallet. You will receive the amount within 24 hours.

agent: Is there anything else I can assist you?

user: that's it
user: tq
agent: Most welcome. Should you need further assistance, please do not hesitate to let us know. I'll be ending the chat here today. Thank you and have a nice day ahead! 😊

agent: Based on your conversation, please rate our services on a scale from 1-5.
1 being the least and 5 being the highest

agent: Hi this is Sha, please give me a moment to carefully review your selected options and I'll get back to you soon. Your patience is appreciated!

user: i would  like to complain
agent: How may I assist you?
user: i requested my drink with no ice but they only give me half cup of the drinks
user: 
user: i requested my drink with no ice but they only give me half cup of the drinks
user: hello?
user: i requested my drink with no ice but they only give me half cup of the drinks Tue 5:52 PM hello?
user: yes
user: ?
agent: If you ask for less or no ice, the drink will have a smaller volume because there will be no ice added.
user: i accept with smaller  volumn
user: but not even half of it
user: 
agent: Thank you for the picture provided. Both drink in the picture is yours?
user: yes
agent: Was your order placed at the counter?
user: in the app
agent: May I get the order ID or registered email address for further checking?
user: email address: adelinewonghiewyaw@gmail.com
user: 24073035609
user: order id
user: i would like to refund now
user: i didn't pickup now
agent: Please hold while I check further on this.
user: please proceed quickly
user: any update?
agent: Thank you for waiting. We apologize for any inconvenience. Upon review, the drink will be served without ice as shown in the picture. Would you prefer to add ice to the drink or would you like to cancel the order?
user: ady 5
user: cancel order
user: any update?
agent: 
We already refunded the amount to your Touch&Go e-wallet. You will receive the amount within 24 hours.


agent: Is there anything else I can assist you?
user: that's it
user: tq
agent: Most welcome. Should you need further assistance, please do not hesitate to let us know. I'll be ending the chat here today. Thank you and have a nice day ahead! 😊","Customer sentiment: Irritated  
Primary Issue: The customer received a drink with no ice but was dissatisfied because it was only half full, despite requesting no ice.  
Cause of issue: The agent explained that ordering a drink with no ice results in a smaller volume, which the customer accepted, but they felt the drink was excessively low in volume (not even half full).  
Overall Summary: The customer initially faced an issue with their drink order, receiving a drink that was only half full despite requesting no ice. After expressing their dissatisfaction, they requested a refund. The agent confirmed that the drink's volume was reduced due to the lack of ice but offered the option to add ice or cancel the order. The customer chose to cancel the order, and the agent processed a refund to the customer's Touch&Go e-wallet, which would be received within 24 hours. The interaction concluded with the customer thanking the agent.",Cancellation - Incorrect Order,MISSED OUT - DRINKS REMARKS,Missed Out - Drinks Remarks,ORDER ACCURACY ISSUES,5932
438149,Cancellation,Customer,"user: hi I need to cancel my order urgently
agent: Greetings! My name is Bawani, and I am here to assist you with your inquiry. We sincerely apologize for the delayed response, which was due to the high volume of inquiries.

agent: Could you please provide us with the reason for your order cancellation?
user: I did not realise delivery was based on previous order
user: I am in Johor bahru now
user: hurry up please..
agent: We appreciate the confirmation. Please stay connected while we confirm with the outlet, as the barista is currently preparing your order and the rider has been assigned. Thank you.
agent: We appreciate your patience.
agent: Your order has been cancelled and the refund has been credited to your ZUS balance.
agent: We hope that was helpful. Is there anything else we can assist you with?
user: TQ So Muc!
agent: 
You're welcome. Should you need further assistance, please do not hesitate to let us know. I'll be ending the chat here today. Thank you and have a nice day ahead! 😊
agent: If you have a minute kindly rate this Live Chat after I end the conversation. I would appreciate your kind feedback on my service today as this will allow me to improve myself to serve you better. 🙂","Customer sentiment: Irritated  
Primary Issue: The customer urgently needed to cancel their order because they did not realize that delivery was based on a previous order, and they were currently in Johor Bahru.  
Cause of issue: The customer was unaware that their current order was linked to a previous one, which led to the need for cancellation.  
Overall Summary: The customer contacted support to urgently cancel their order due to confusion about delivery being based on a previous order while they were in Johor Bahru. The agent confirmed the cancellation and processed a refund to the customer's ZUS balance. The interaction ended positively with the customer expressing gratitude.",Cancellation - Wrong Outlet / Address,Cancellation Requests,Cancellation Requests,Cancellation Requests,3519
436565,Feedback / Improvement,Operation,"user: 
Are you understaff at KOMTAR penang outlet?


agent: Hi Hilmi.
agent: Thank you for contacting ZUS Coffee.
agent: My name is Hana and I'll be assisting you today.

agent: We are really sorry for the inconvenience.
agent: We will definitely forward this the relevant department and outlet.
agent: Is there anything else I can help you with?
user: 
user: People are queing
user: No other issue
agent: Once again, we are so sorry you experienced that. We strive to provide a much better experience than what you’ve had today. 
agent: Should you need further assistance, please do not hesitate to let us know. I'll be ending the chat here today. Thank you and have a nice day ahead! 😊","Customer sentiment: Irritated  
Primary Issue: The customer is inquiring about understaffing at the KOMTAR Penang outlet, indicating that there are long queues.  
Cause of issue: The customer is experiencing long wait times due to what they perceive as understaffing at the outlet.  
Overall Summary: The customer expressed concern about understaffing at the KOMTAR Penang outlet, leading to long queues. The agent acknowledged the issue and apologized for the inconvenience, assuring the customer that the feedback would be forwarded to the relevant department. The interaction ended with the agent offering further assistance if needed.",Complaints,PERFORMANCE - BARISTA BEHAVIOUR / SERVICE,Performance - Barista Behaviour / Service,OUTLET & STAFF COMPLAINTS,4633
