ticket.id,gt_category_1,gt_department,text,summary,gt_category_2,level_2,level_2_category_2,level_1,token_count
438655,Order Info / Status,Operation,"user: Issue : 2  Order ID: 24070721498  Image: https://r3.app.yellow.ai/api/blob-proxy/render/r3-ym-uploads/eDE3MTAyMzQ2NjkzNzcvMjU5OTZmZWEtZWZmYy00YTI4LWIxZTEtOGI5ZjNiZGQ1NDMzLmpwZw==  Affected Items: Order ID: MY0228-24070721498Already remark “no sugar, no ice”, but still served with full ice. And when i highlight and request to redo, she never apologize and just take out the ice.(only remove few ice cubes)Pls take some against the staff, im very dissatisfy on her attitude. Channel: facebook  Chat URL: https://cloud.yellow.ai/public/messages/a9c98542dd91bca8b5a09e8ad27023c37016a9fd690f4d37569fd5aa62393a9e7f6102c732d3a7b6fa3e/668a3fb0bdbb5300011be2cd
user: 3
agent: Welcome to ZUS Coffee! ⚡

agent: For your inquiry regarding ZUS Coffee, please select the country you are interested in

user: 1
agent: Please select the language you want to converse in

user: en
agent: Great! May I have your mobile number?
(eg: 601XXXXXXXX)

user: 60126855899
agent: Thank you for your details.

agent: Hi Evelyn Lee how can I help you today?

user: 3
agent: Understood.
Please select the relevant options so I can assist you more effectively.

user: 2
agent: We're sorry for the wrong item(s) in your order.

We'll exercise more care when preparing and packing your order in the future.

Tell us which of the issues below you're facing:

user: 2
agent: Please share the order ID (eg: MY0290-23123126284) for our reference.

user: MY0228-24070721498
agent: Please provide us with a clear image of the items you have received so that we can assist you accordingly.

user: 
agent: Let us fix this for you as soon as possible.

Can you please tell us which are the affect items?
Example:
Order ID: MY0290-23123126284
Received wrong item 2x latte instead of Ice Americano

user: Order ID: MY0228-24070721498
Already remark “no sugar, no ice”, but still served with full ice. And when i highlight and request to redo, she never apologize and just take out the ice.(only remove few ice cubes)
Pls take some against the staff, im very dissatisfy on her attitude.
agent: Let me find an agent to help you with this.

agent: A live agent has been connected

agent: Hi this is Vethiyani, please give me a moment to carefully review your selected options and I'll get back to you soon. Your patience is appreciated!

agent: Good Day to you. Thank you for contacting ZUS Coffee Malaysia.

agent: Apologies on the inconvenience that caused.

agent: We are making it a top priority to address this issue and will promptly escalate it to the appropriate team for thorough investigation and to implement any necessary measures to prevent its recurrence in the future.

agent: Your concerns are important to us and we are committed to resolving them effectively.

agent: We are extremely sorry about this unpleasant experience.

user: This has totally spoil the drink and my mood
user: Pls do compensation for me!
agent: We understand how unpleasant this experience must have been for you and we would like to apologize for this.

agent: We have brought this matter to the attention of the appropriate team for further action, to ensure that this error is not repeated in the future.

agent: Once again, we apologize for the unpleasant experience you encountered with us. As a token of our apology, we have inserted a
special voucher for a 20% discount in your ZUS Wallet valid for 14 days from today onwards. This voucher code is applicable for
selected beverages for your next order. Kindly take note this voucher code is not applicable for Discounted Price Items, ZUS
Bottled Necessity, Bottled Drinks, Cakes, Pastries, Hot Meals, Healthy Snacks, Merchandise OR any additional charges for modifiers
to the standard drink(s) (e.g.: extra shot/extra syrup/extra drizzle/soy milk/almond milk/oat milk etc.) as per the voucher Terms
& Condition.

user: Thanks. Really hope your team can look into this matter, as this is not the first time that im dissatisfying with the staff attitude for this outlet!
agent: We truly regretted on the incident that you have experienced . We will take necessary action toward this issue

agent: Apart from this, is there anything else that I can help you with?

agent: As we have not heard back from you for some time, we'll proceed to close this chat. Should you need further assistance, please do not hesitate to chat with us here and we will assist you as soon as we can.

Thank you and have a pleasant day ahead! 😊

agent: Based on your conversation, please rate our services on a scale from 1-5.
1 being the least and 5 being the highest

agent: Hi this is Vethiyani, please give me a moment to carefully review your selected options and I'll get back to you soon. Your patience is appreciated!

agent: Good Day to you. Thank you for contacting ZUS Coffee Malaysia.
agent: Apologies on the inconvenience that caused. 

agent: We are making it a top priority to address this issue and will promptly escalate it to the appropriate team for thorough investigation and to implement any necessary measures to prevent its recurrence in the future.
agent: Your concerns are important to us and we are committed to resolving them effectively.
agent: We are extremely sorry about this unpleasant experience. 

user: This has totally spoil the drink and my mood
user: Pls do compensation for me!
agent: We understand how unpleasant this experience must have been for you and we would like to apologize for this.
agent: We have brought this matter to the attention of the appropriate team for further action, to ensure that this error is not repeated in the future.

agent: Once again, we apologize for the unpleasant experience you encountered with us.As a token of our apology, we have inserted a special voucher for a 20% discount in your ZUS Wallet valid for 14 days from today onwards.This voucher code is applicable for selected beverages for your next order. Kindly take note this voucher code is not applicable for Discounted Price Items, ZUS Bottled Necessity, Bottled Drinks, Cakes, Pastries, Hot Meals, Healthy Snacks, Merchandise OR any additional charges for modifiers to the standard drink(s) (e.g.: extra shot/extra syrup/extra drizzle/soy milk/almond milk/oat milk etc.) as per the voucher Terms & Condition.
user: Thanks. Really hope your team can look into this matter, as this is not the first time that im dissatisfying with the staff attitude for this outlet!
agent: We truly regretted on the incident that you have experienced . We will take necessary action toward this issue
agent: Apart from this, is there anything else that I can help  you with?
agent: 
As we have not heard back from you for some time, we'll proceed to close this chat. Should you need further assistance, please do not hesitate to chat with us here and we will assist you as soon as we can.

Thank you and have a pleasant day ahead! 😊
","Customer sentiment: Irritated  
Primary Issue: The customer received a drink that was supposed to have ""no sugar, no ice,"" but it was served with full ice. When the customer requested a redo, the staff member only removed a few ice cubes and did not apologize, leading to dissatisfaction with the staff's attitude.  
Cause of issue: The staff failed to follow the customer's order instructions and did not handle the situation appropriately when the customer raised the issue.  
Overall Summary: The customer expressed frustration over receiving a drink with full ice despite specifying ""no ice"" in their order. The staff's inadequate response and lack of apology exacerbated the situation, leading the customer to request compensation. The agent acknowledged the issue, apologized, and offered a 20% discount voucher as compensation while assuring that the matter would be escalated for further action. The customer hopes for improvements in staff attitude, indicating this is not the first negative experience.",Missed Out - Remarks,MISSED OUT - DRINKS REMARKS,Missed Out - Drinks Remarks,ORDER ACCURACY ISSUES,6329
435577,Outlet,Operation,"user: hello sorry i'm away just now 
user: i want to cancel my order because matcha strawberry is out of stock 
agent: Hi this is Buvana, please give me a moment to carefully review your selected options and I'll get back to you soon. Your patience is appreciated!

agent: We apologize for the delay in responding as we have received many requests. Rest assured, our team is improving their response time to inquiries.
agent: May I confirm you want to cancel the whole order or just the Matcha Strawberry Latté?
user: the whole order
agent: We are extremely sorry for the unpleasant experience you have encountered with us.
agent: We have refunded the order to your ZUS balance. Kindly check and get back to us if you need any assistance.
agent: We deeply regret any inconvenience or frustration our services may have caused you. We value your business and want to ensure that we make things right in the future.
agent:  Apart from this, is there anything else we could assist you with?
user: no, thankyou so much 
agent: Should you need further assistance, please do not hesitate to let us know. I'll be ending the chat here today. Thank you and have a nice day ahead! 😊","Customer sentiment: Neutral  
Primary Issue: The customer wants to cancel their order because the Matcha Strawberry Latté is out of stock.  
Cause of issue: The Matcha Strawberry Latté being out of stock is the reason for the cancellation of the entire order.  
Overall Summary: The customer initiated the conversation to cancel their order due to the unavailability of the Matcha Strawberry Latté. The agent confirmed the cancellation and processed a refund to the customer's ZUS balance. The agent expressed apologies for the inconvenience and offered further assistance, but the customer declined. The interaction ended on a positive note with the agent wishing the customer a nice day.",OOS,Cancellation Requests,Cancellation Requests,Cancellation Requests,3514
436728,Outlet,Operation,"user: hello, i need to cancel one drink from my order
user: since the outlet called to let me know there's strawberry shortage in the store so i have to cancel the matcha strawberry latte drink. but i'm not sure how to do that
agent: Hi Syahidah. My name is Khuzairi and I will be assisting you today.
agent: We apologize for the inconvenience.
agent: We have confirmed with the outlet that the 1  Matcha Strawberry Latté is out of stock at the moment.
agent: May we proceed to refund x 1  1 Matcha Strawberry Latté to your ZUS balance as it will be immediate?
user: yes please
user: thank you
agent: We have refunded the order to ZUS Balance, kindly check on your end.
agent: We hope this information is helpful. Apart from this, is there anything else we could assist you with?
agent: Hi, just wanted to check in and see if you're still with me?
user: yep..everything else is fine
agent: Should you need further assistance, please do not hesitate to let us know. I'll be ending the chat here today. Thank you and have a nice day ahead! 😊
agent: If you have a minute kindly rate this Live Chat after I end the conversation. I would appreciate your kind feedback on my service today as this will allow me to improve myself to serve you better. 🙂","Customer sentiment: Happy  
Primary Issue: The customer needed to cancel a drink from their order due to a strawberry shortage at the outlet, specifically the Matcha Strawberry Latte.  
Cause of issue: The root cause of the issue was the outlet's notification about the strawberry shortage, which made the Matcha Strawberry Latte unavailable for the customer.  
Overall Summary: The customer, Syahidah, contacted customer service to cancel a Matcha Strawberry Latte due to a strawberry shortage. The agent confirmed the drink was out of stock and offered to refund it to the customer's ZUS balance, which the customer accepted. The refund was processed immediately, and the customer expressed satisfaction with the resolution, indicating everything else was fine. The interaction ended on a positive note, with the agent encouraging feedback on their service.",OOS,CANCELLATION - INCORRECT ORDER,Cancellation - Incorrect Order,CANCELLATION REQUESTS,4529
452938,Outlet,Emergency,"user: Order ID: 24072914610 Ticket Category: Payment Error / Failure Issue: User is facing Payment Error / Failure  Chat/ Image URL: Not Provided Channel: Mobile App  Chat URL: https://cloud.yellow.ai/public/messages/a9c98542dd91bca8b5a09e8ad27023c32b43ffbe2c0c1570549bd3a9663b399f6e74579e6281f5ffb32c7515834432745111e06bf20124d4/66a71b1ed50d2200012aff86
agent: Welcome to ZUS Coffee! ⚡

agent: Please select the language you want to converse in

user: please cancel my recent order
agent: We apologize for not meeting your expectations on this occasion.

Please select the reason for cancellation

user: outlet blackout
agent: My apologies, I do not understand your request. Please select from the menu.

agent: We apologize for not meeting your expectations on this occasion.

Please select the reason for cancellation

user: Incorrect Order / Outlet
agent: Kindly provide us with your Order ID (eg: MY0290-23123126284) for further assistance.

user: 24072914610
agent: Apologies, it appears that the order ID you entered is incorrect. Could you please double-check it and enter it again?

user: how to get this id
agent: Apologies, it appears that the order ID you entered is incorrect. Could you please double-check it and enter it again?

user: 24072914610
agent: Apologies, it appears that the order ID you entered is incorrect. Could you please double-check it and enter it again?

user: any refund for my cancellation order?
agent: Apologies, it appears that the order ID you entered is incorrect. Could you please double-check it and enter it again?

user: any live agent?
agent: Before we proceed further could you help me with your name?

user: Hafiz
agent: Sure Hafiz, please help me with your mobile number.

user: 0194360859
agent: Hafiz, can you please enter your email ID?

user: alhafizmnp@gmail.com
agent: Please select the relevant category.

user: View More
agent: Please select the relevant category.

user: ZUS Voucher
agent: ZUS Voucher Related Questions:

1. How do I entitle for the BUY 1 FREE 1 voucher code?
2. How can I redeem my BUY 1 FREE 1 Birthday Cake?
3. I forgot to enter my voucher code
4. I claimed the voucher but did not have enough time to redeem it. Can I reclaim it?
5. How to use the BUY 3 FREE 1 voucher code?
6. I'm able to apply a voucher code on discounted price item?
7. Are vouchers applicable for bottled drinks?
8. Go back

user: back
agent: Please select the relevant category.

user: Technical Issue
agent: Technical Issue Related Questions

1. Why my ZUS App isn't working?
2. Go back

user: 2
agent: Please select the relevant category.

user: Order Related
agent: Order Related Questions:

1. I have accidentally placed a pick-up order, can I change it to delivery instead?
2. Can I edit the delivery address for my submitted order?
3. I have a missing item(s) in my order or received a wrong order
4. Can I transfer my order to another outlet?
5. Can I add more items to my submitted order?
6. Can I add remarks for my order after submitting my order?
7. My drinks/food arrived in poor conditions
8. Do you take corporate or bulk order?
9. Go back

user: live agent
agent: Hafiz, can you please enter your email ID?

user: liveagent
agent: Please enter a valid email ID

user: fuck la
agent: Please enter a valid email ID

user: alhafizmnp@gmail.com
agent: Please select the relevant category.

user: Order Related
agent: Order Related Questions:

1. I have accidentally placed a pick-up order, can I change it to delivery instead?
2. Can I edit the delivery address for my submitted order?
3. I have a missing item(s) in my order or received a wrong order
4. Can I transfer my order to another outlet?
5. Can I add more items to my submitted order?
6. Can I add remarks for my order after submitting my order?
7. My drinks/food arrived in poor conditions
8. Do you take corporate or bulk order?
9. Go back

user: 6
agent: Yes. Kindly reach out to our Customer Happiness team via Live Chat OR WhatsApp us at 6012-8161340 (wasap.my/60128161340) to assist you accordingly on this.

agent: Did I answer your question?

user: No
agent: Apologies, please wait while I connect you with an agent to serve you better

agent: Hafiz, can you please enter your email ID?

user: alhafizmnp@gmail.com
agent: Please select the relevant category.

user: Go Back
agent: Sorry, the phone number you entered appears to be invalid. Please ensure you have entered a valid ZUS Coffee registered contact number.
(ex: 601XXXXXXXX)

user: 60194360859
agent: Thank you for your details.

agent: Hi Mo Hafiz how can I help you today?

user: 6
agent: Understood.
Please select the relevant options so I can assist you more effectively.

user: Payment Error / Failure
agent: Please share your order ID (eg: MY0290-23123126284) so we can help you.

user: MY0290-24072914610
agent: Hello Mo Hafiz! We have checked your payment status, and it shows that your payment has been successfully completed. Thank you for your purchase!

agent: Did I answer your question?

user: No
agent: Apologies, please wait while I connect you with an agent to serve you better

agent: 

user: i dont receive my order
user: please refund
user: zus outlet bakar arang blackout
agent: Hi this is Nur, please give me a moment to carefully review your selected options and I'll get back to you soon. Your patience is appreciated!

agent: Hi Mo Hafiz.

agent: We apologies for the inconvenience caused.

agent: We understand how frustrating this must be for you, and we want to assure you that we are working to make things right.

agent: May we offer you a refund through ZUS Balance as it will be immediate? 

user: ok
user: refund already?
user: i want to order at other outlet
agent: We have processed the refund to your ZUS Balance and you may check accordingly from your end by going to ZUS App > Account > Check the balance.

agent: If the refund is not reflected, kindly re-login to the ZUS App.

agent: Once again, we're extremely sorry for the unpleasant experience.

agent: We understand your frustration and we will try our best to improve and serve you better in the future.

agent: Apart from that, is there anything else that I can assist you?

agent: Hi, just want to check if you are still with me?

agent: As we have not heard back from you for some time, we'll proceed to close this email. Should you need further assistance, please do not hesitate to contact us here and we will assist you as soon as we can.
Thank you and have a pleasant day ahead! 😊

agent: Based on your conversation, please rate our services on a scale from 1-5.
1 being the least and 5 being the highest

user: i dont receive my order
user: please refund
user: zus outlet bakar arang blackout
agent: Hi this is Nur, please give me a moment to carefully review your selected options and I'll get back to you soon. Your patience is appreciated!

agent: Hi Mo Hafiz.
agent: We apologies for the inconvenience caused.
agent: We understand how frustrating this must be for you, and we want to assure you that we are working to make things right.
agent: May we offer you a refund through ZUS Balance as it will be immediate? 
user: ok
user: refund already?
user: i want to order at other outlet
agent: We have processed the refund to your ZUS Balance and you may check accordingly from your end by going to ZUS App > Account > Check the balance.
agent: If the refund is not reflected, kindly re-login to the ZUS App.
agent: Once again, we're extremely sorry for the unpleasant experience.
agent: We understand your frustration and we will try our best to improve and serve you better in the future.
agent: Apart from that, is there anything else that I can assist you?
agent: Hi, just want to check if you are still with me?

agent: As we have not heard back from you for some time, we'll proceed to close this email. Should you need further assistance, please do not hesitate to contact us here and we will assist you as soon as we can.Thank you and have a pleasant day ahead! 😊
user: Order ID: 24072914610  Ticket Category: Order not received  Issue: outlet blackout Channel: WhatsApp  Chat URL: https://cloud.yellow.ai/public/messages/a9c98542dd91bca8b5a09e8ad27023c37116acfd6a0d48335f9bdbb8727c67cb2d3405d621/66a71d9fe41593000135bf94
user: Hello zus
agent: Welcome to ZUS Coffee! ⚡

agent: Please select the language you want to converse in

user: any refund for my cancellation order?
agent: My apologies, I do not understand your request. Please select from the menu.

user: ms
agent: Please select the language you want to converse in

agent: Terima kasih atas maklumat anda.

agent: Hai Mo Hafiz, bagaimana saya boleh membantu anda hari ini?

user: ms
agent: Hai Mo Hafiz, bagaimana saya boleh membantu anda hari ini?

user: 3
agent: Faham.
Sila pilih pilihan yang berkaitan agar saya dapat membantu anda dengan lebih efektif.

user: 7
agent: Kami memahami ini bukanlah satu pengalaman yang baik yang anda harapkan. Sila berikan kami masa untuk menyemak dan mencari punca masalah ini.

agent: Sila kongsi ID (contohnya: MY0290-23123126284) pesanan untuk rujukan kami.

user: MU0290-24072914610
agent: Bolehkah anda beritahu kami item mana yang terjejas?
Contoh:
Tidak menerima keseluruhan pesanan.

user: outlet blackout
agent: 

user: thet click received my orde
user: 
user: saya tak dpt pon order nie
user: kena click received
user: slow respond la
user: shit
agent: Hi Mo Hafiz, we're currently handling multiple inquiries. Please bear with us as we prioritise and attend to yours as soon as possible. Thank you for your patience.

agent: Hi Mo Hafiz.

agent: We apologies for the inconvenience caused.

agent: We are terribly sorry for the negative experience.

agent: We understand how frustrating this must be for you, and we want to assure you that we are working to make things right.

agent: May we offer you a refund through ZUS Balance as it will be immediate? 

agent: Hi, just want to check if you are still with me?

agent: As we have not heard back from you for some time, we'll proceed to close this email. Should you need further assistance, please do not hesitate to contact us here and we will assist you as soon as we can.
Thank you and have a pleasant day ahead! 😊

agent: Berdasarkan perbualan sebentar tadi, sila nilai perkhidmatan kami dari skala 1 hingga 5.
1 bermakna yang paling rendah dan 5 bermakna yang tertinggi.

user: five
agent: Sila kembali jika mempunyai sebarang soalan untuk semakan lebih lanjut.

Apabila memerlukan bantuan, hanya katakan ""Hi""

user: thet click received my orde
user: 
user: saya tak dpt pon order nie
user: kena click received
user: slow respond la
user: shit
agent: Hi Mo Hafiz, we're currently handling multiple inquiries. Please bear with us as we prioritise and attend to yours as soon as possible. Thank you for your patience.
agent: Hi Mo Hafiz.
agent: We apologies for the inconvenience caused.
agent: We are terribly sorry for the negative experience.

agent: We understand how frustrating this must be for you, and we want to assure you that we are working to make things right.

agent: May we offer you a refund through ZUS Balance as it will be immediate? 
agent: Hi, just want to check if you are still with me?

agent: As we have not heard back from you for some time, we'll proceed to close this email. Should you need further assistance, please do not hesitate to contact us here and we will assist you as soon as we can.Thank you and have a pleasant day ahead! 😊","Customer sentiment: Irritated  
Primary Issue: The customer, Hafiz, is facing a payment error and has not received his order due to an outlet blackout. He is seeking a refund for his cancellation order.  
Cause of issue: The customer’s order was not fulfilled because the outlet experienced a blackout, leading to a payment error and subsequent cancellation request. The customer also faced difficulties in providing the correct order ID during the interaction.  
Overall Summary: Hafiz contacted customer service regarding a payment error and the non-receipt of his order, which was attributed to an outlet blackout. After multiple attempts to clarify his order ID and express his frustration, the agent offered a refund through ZUS Balance, which was accepted by the customer. The agent apologized for the inconvenience and assured Hafiz that they were working to improve their service. The interaction ended with Hafiz confirming the refund process.",Outlet - Blackout,PAYMENT ERROR / FAILURE,Payment Error / Failure,PAYMENT & REFUND ISSUES,7296
